{
  "schema_version": "devseek.c0-manifest-aggregator-wiring/v1",
  "integrity": {
    "hash_algorithm": "sha256",
    "canonicalization_version": "devseek-canonical-json/v1"
  },
  "wiring_id": "DEVSEEK-GATE0-C0-MANIFEST-AGGREGATOR-WIRING/v1",
  "wiring_version": 1,
  "source_status": "verified",
  "integrity_scope": "local-manifest-aggregator-wiring-conformance",
  "qualification_eligible": false,
  "qualification_effect": "NONE",
  "claims_permitted": false,
  "asserts_gate_pass": false,
  "sources": {
    "capability_ledger": {
      "path": "docs/process/devseek-capability-ledger.json",
      "schema_version": "devseek.capability-ledger/v1",
      "ledger_id": "DEVSEEK-CAPABILITY-LEDGER/v1",
      "source_sha256": "08bb2cc53b13c32807373db73cb80cda97a745cc4941aa919bbac4e76f5c45d5"
    },
    "aggregator_policy": {
      "path": "docs/process/devseek-qualification-aggregator-policy.json",
      "policy_id": "DEVSEEK-G0C-LOCAL-AGGREGATOR-POLICY",
      "policy_sha256": "08897f5f2c6994fd2ae4d130648c38ab2eb6971b840a02b3b212430fcd45fb9e",
      "source_sha256": "dafca6aa79755f85bac27c193782a8001ae984267d7b91963a0180cc8208c060"
    },
    "aggregator_policy_schema": {
      "path": "docs/process/devseek-qualification-aggregator-policy.schema.json",
      "source_sha256": "10f90ce1f89a96a6d92fef2f1c79ba51d0bbf530458218df7019bdf9fb6a9f8c"
    },
    "qualification_evidence_manifest_schema": {
      "path": "docs/process/devseek-qualification-evidence-manifest.schema.json",
      "source_sha256": "b00ef568b7a635cc3db92266e3183dc6cd947ea700840428905290febd6a057e"
    },
    "qualification_retention_lock_schema": {
      "path": "docs/process/devseek-qualification-retention-lock.schema.json",
      "source_sha256": "ed3b23396fba22c3be1a759037bcf2a97b9f9a36a1da7a80928bc23724a94642"
    },
    "qualification_plan_schema": {
      "path": "docs/process/devseek-qualification-plan.schema.json",
      "source_sha256": "34415290e152073afde0e43016d2b13b46ddfcefe1e4f083c0f0b0ccd0a7fc1b"
    },
    "qualification_event_schema": {
      "path": "docs/process/devseek-qualification-event.schema.json",
      "source_sha256": "b6d6a9b3e94e751d539d8675847cc2a50ea3bc2e3a39463a0feb709806a7f7f5"
    },
    "qualification_receipt_schema": {
      "path": "docs/process/devseek-qualification-receipt.schema.json",
      "source_sha256": "46d40c4c127a34ce7ddcc70d60829c56c6ba1d78e597c6b01488c71462152043"
    },
    "run_evidence_correlation_schema": {
      "path": "docs/process/devseek-run-evidence-correlation.schema.json",
      "source_sha256": "ae80615276a57134c90017a69aa10e97cd4c08e8be3096d37be214ab0c480663"
    },
    "run_evidence_wiring_source": {
      "path": "docs/process/devseek-c0-run-evidence-wiring.json",
      "source_sha256": "c37d44a2167534cbc7a14cd9d0c344ae1241b64b5bea5b2a1ab664f9cca52343"
    },
    "qualification_evidence_manifest_source": {
      "path": "scripts/lib/devseek-qualification-evidence-manifest.mjs",
      "source_sha256": "06068dddca365964e3dfeb55b76043e5c12a18e6f2242aa35325d0688107008f"
    },
    "qualification_evidence_manifest_checker": {
      "path": "scripts/devseek-qualification-evidence-manifest-check.mjs",
      "source_sha256": "bb4c258e5a7248d40b2f9e3093b9fcf78131be9885004f8e93a127df54451335"
    },
    "qualification_evidence_manifest_oracle": {
      "path": "scripts/test/devseek-qualification-evidence-manifest.test.mjs",
      "source_sha256": "dd74857c9bb164374e39fd5ffba3ae55ef303a9cf5c658e1d9eeba0e1d874572"
    },
    "package_scripts": {
      "path": "package.json",
      "source_sha256": "0c48c818f839625c2974fb22aa8277db0ab1a3e2dfcde9544d804f8f63837640"
    },
    "phase_gate_source": {
      "path": "scripts/devseek-phase0-12-verify.mjs",
      "source_sha256": "46999697802ec4ee0f56245cf53b211ff6f6b75e05e7e530dee060011eca6524"
    },
    "checker_source": {
      "path": "scripts/devseek-c0-manifest-aggregator-wiring-check.mjs",
      "source_sha256": "b0c594e758cab26e61ab051d61f21908fe4c18ab14d6dd30b8662f8197f30099"
    },
    "oracle_source": {
      "path": "scripts/test/devseek-c0-manifest-aggregator-wiring.test.mjs",
      "source_sha256": "04a35f7bf688f981f056449bf1a5d9c1f710653059d0f1b8c1b80a79cc1bf714"
    }
  },
  "owners": {
    "aggregator": {
      "capability_id": "C0-QUALIFICATION-AGGREGATOR",
      "implementation_state": "wired",
      "authority_port": "QualificationAggregationPort",
      "required_component_paths": [
        {
          "path": "docs/process/devseek-qualification-aggregator-policy.schema.json",
          "present": true
        },
        {
          "path": "docs/process/devseek-qualification-aggregator-policy.json",
          "present": true
        },
        {
          "path": "docs/process/generated/devseek-qualification-evidence-manifest.md",
          "present": true
        },
        {
          "path": "docs/process/devseek-c0-manifest-aggregator-wiring.json",
          "present": true
        },
        {
          "path": "docs/process/devseek-c0-manifest-aggregator-wiring.schema.json",
          "present": true
        },
        {
          "path": "docs/process/generated/devseek-c0-manifest-aggregator-wiring.md",
          "present": true
        },
        {
          "path": "scripts/devseek-qualification-evidence-manifest-check.mjs",
          "present": true
        },
        {
          "path": "scripts/devseek-c0-manifest-aggregator-wiring-check.mjs",
          "present": true
        },
        {
          "path": "scripts/lib/devseek-c0-manifest-aggregator-wiring.mjs",
          "present": true
        },
        {
          "path": "scripts/lib/devseek-qualification-evidence-manifest.mjs",
          "present": true
        },
        {
          "path": "scripts/test/devseek-c0-manifest-aggregator-wiring.test.mjs",
          "present": true
        },
        {
          "path": "scripts/test/devseek-qualification-evidence-manifest.test.mjs",
          "present": true
        }
      ],
      "verification_commands": [
        "npm run verify:qualification-evidence-manifest",
        "npm run verify:c0-manifest-aggregator-wiring",
        "npm run verify:external-authority-adapter"
      ],
      "verification_has_qualification_evidence_manifest": true,
      "verification_has_c0_manifest_aggregator_wiring": true,
      "expected_authority_port": "QualificationAggregationPort"
    },
    "evidence_manifest": {
      "capability_id": "C0-QUALIFICATION-EVIDENCE-MANIFEST",
      "implementation_state": "wired",
      "authority_port": "QualificationEvidenceManifestPort",
      "required_component_paths": [
        {
          "path": "docs/process/devseek-qualification-evidence-manifest.schema.json",
          "present": true
        },
        {
          "path": "docs/process/devseek-qualification-retention-lock.schema.json",
          "present": true
        },
        {
          "path": "docs/process/generated/devseek-qualification-evidence-manifest.md",
          "present": true
        },
        {
          "path": "docs/process/devseek-c0-manifest-aggregator-wiring.json",
          "present": true
        },
        {
          "path": "docs/process/devseek-c0-manifest-aggregator-wiring.schema.json",
          "present": true
        },
        {
          "path": "docs/process/generated/devseek-c0-manifest-aggregator-wiring.md",
          "present": true
        },
        {
          "path": "scripts/devseek-qualification-evidence-manifest-check.mjs",
          "present": true
        },
        {
          "path": "scripts/devseek-c0-manifest-aggregator-wiring-check.mjs",
          "present": true
        },
        {
          "path": "scripts/lib/devseek-c0-manifest-aggregator-wiring.mjs",
          "present": true
        },
        {
          "path": "scripts/lib/devseek-qualification-evidence-manifest.mjs",
          "present": true
        },
        {
          "path": "scripts/test/devseek-c0-manifest-aggregator-wiring.test.mjs",
          "present": true
        },
        {
          "path": "scripts/test/devseek-qualification-evidence-manifest.test.mjs",
          "present": true
        }
      ],
      "verification_commands": [
        "npm run verify:qualification-evidence-manifest",
        "npm run verify:c0-manifest-aggregator-wiring",
        "npm run verify:external-authority-adapter"
      ],
      "verification_has_qualification_evidence_manifest": true,
      "verification_has_c0_manifest_aggregator_wiring": true,
      "expected_authority_port": "QualificationEvidenceManifestPort"
    }
  },
  "aggregation_contract": {
    "adapter_id": "G0-C-MANIFEST-AGGREGATOR-ADAPTER/v1",
    "adapter_source_ref": "scripts/lib/devseek-qualification-evidence-manifest.mjs#aggregateQualificationEvidence",
    "policy_path": "docs/process/devseek-qualification-aggregator-policy.json",
    "manifest_schema_path": "docs/process/devseek-qualification-evidence-manifest.schema.json",
    "retention_schema_path": "docs/process/devseek-qualification-retention-lock.schema.json",
    "package_script_present": true,
    "phase_gate_id": "c0-manifest-aggregator-wiring-conformance",
    "phase_gate_present": true,
    "policy_local_only": true,
    "policy_has_zero_repository_claim_rules": true,
    "manifest_schema_requires_run_evidence_auxiliary": true,
    "retention_schema_requires_external_anchor_boundary": true,
    "policy_schema_forbids_unknowns": true,
    "run_evidence_wiring_is_prerequisite": true,
    "reader_recomputes_manifest_derivation": true,
    "reader_rejects_writer_summary": true,
    "reader_verifies_retention_and_anchor": true,
    "reader_checks_current_state_and_provenance": true,
    "reader_preserves_failures_and_vetoes": true,
    "reader_requires_exact_dependency_tuple": true,
    "reader_consumes_run_evidence_as_auxiliary": true,
    "aggregator_produces_protected_claims_locally": false,
    "same_repository_hash_is_trust_root": false,
    "writer_summary_is_authoritative": false,